{
  "lang": "en-us",
  "arch": "amd64",
  "edition": "Professional",
  "version": "11",
  "sha1size": "8ceab2838f8e90180ac7490e8752157fb05588cb:4680320173",
  "url": "http://dl.delivery.mp.microsoft.com/filestreamingservice/files/009d9a0d-8e1a-45ce-9540-21377534803e/26100.4349.250607-1500.ge_release_svc_refresh_CLIENTCONSUMER_RET_x64FRE_en-us.esd"
}